<?xml version="1.0" encoding="UTF-8" standalone="no"?>
<view class-name="MainGameLayerView" prefix="layer_main_game" type="layer" exitable="false" 
		super="CommonLayer" background-name="default" size="320.0, 480.0"
		template-name="Common"
		exported="true"
		comment=""
		xmlns="http://www.tvd.com/tools"
		xmlns:xsi="http://www.w3.org/2001/XMLSchema-instance"
		xsi:schemaLocation="http://www.tvd.com/tools ../xsd/view_2_0.xsd">
	<position-name value="main_game_layer" />
	<position value="default" />
	<define-path value="/Volumes/Working/Bitbucket/supernatural-memory/supernatural-memory/SupernaturalMemory/Classes/Utils/Defines" />
	<parameters-path value="/Volumes/Working/Bitbucket/supernatural-memory/supernatural-memory/SupernaturalMemory/Classes/Utils/GameParams" />
	<images-inputpath value="/Volumes/Data/Storage/Images/supernatural-memory/main_game_layer" />
	<images-path value="/Volumes/Working/Bitbucket/supernatural-memory/supernatural-memory/SupernaturalMemory/Resources/iphone" />
	<xibcontainer-path value="/Volumes/Working/Bitbucket/supernatural-memory/supernatural-memory/SupernaturalMemory/Resources/screenshots/iphone" used="true" />
	<screencontainer-path value="/Volumes/Working/Bitbucket/supernatural-memory/supernatural-memory/SupernaturalMemory/Wireframing/WireframingScreen/iphone" />
	<androidcontainer-path value="/Volumes/Working/Bitbucket/supernatural-memory/supernatural-memory/SupernaturalMemory/proj.android/res/layout/iphone" />
	<class-path value="/Volumes/Working/Bitbucket/supernatural-memory/supernatural-memory/SupernaturalMemory/Classes/View/Layer" />

	<resource comment="resource for view">
		<image id="main_game_layer_resource_wood_back_active" 
			phony-path="main_game_layer/resource/wood_back_active.png"  />
		<image id="main_game_layer_resource_wood_back_normal" 
			phony-path="main_game_layer/resource/wood_back_normal.png"  />
		<image id="main_game_layer_resource_wood_bg" 
			phony-path="main_game_layer/resource/wood_bg.png"  />
		<image id="main_game_layer_resource_wood_fail_disable" 
			phony-path="main_game_layer/resource/wood_fail_disable.png"  />
		<image id="main_game_layer_resource_wood_replay_active" 
			phony-path="main_game_layer/resource/wood_replay_active.png"  />
		<image id="main_game_layer_resource_wood_replay_normal" 
			phony-path="main_game_layer/resource/wood_replay_normal.png"  />
		<image id="main_game_layer_resource_wood_screenshot" 
			phony-path="main_game_layer/resource/wood_screenshot.png"  />
		<image id="main_game_layer_resource_wood_setting_active" 
			phony-path="main_game_layer/resource/wood_setting_active.png"  />
		<image id="main_game_layer_resource_wood_setting_normal" 
			phony-path="main_game_layer/resource/wood_setting_normal.png"  />
		<image id="main_game_layer_resource_wood_square_default" 
			phony-path="main_game_layer/resource/wood_square_default.png"  />
		<image id="main_game_layer_resource_wood_square_text_disable" 
			phony-path="main_game_layer/resource/wood_square_text_disable.png"  />
		<image id="main_game_layer_resource_wood_suggest_active" 
			phony-path="main_game_layer/resource/wood_suggest_active.png"  />
		<image id="main_game_layer_resource_wood_suggest_normal" 
			phony-path="main_game_layer/resource/wood_suggest_normal.png"  />
	</resource>
</view>
